{
  "$schema": "https://json-schema.org/draft/2020-12/schema",
  "$id": "collection_info.json",
  "title": "CollectionInfo",
  "description": "One registry collection the query API can serve.",
  "type": "object",
  "required": ["id", "label", "model", "dim", "default"],
  "properties": {
    "id": { "type": "string" },
    "label": { "type": "string" },
    "model": { "type": "string" },
    "dim": { "type": "integer" },
    "chunk_method": { "type": ["string", "null"] },
    "chunk_size": { "type": ["integer", "null"] },
    "default": { "type": "boolean" },
    "is_default": {
      "description": "True on exactly one listed entry: the collection a request resolves to when it omits `collection` (the `default` pointer, DEFAULT_COLLECTION_ID). `default` is a pointer, never a registry entry of its own (ADR-0002 decision 5); this flag says which real entry it names. This is the canonical long-term field — the older `default` (same value) collides in name with `CollectionsResponse.default`, which is the id string; clients should read `is_default`. Optional so older servers stay conformant.",
      "type": "boolean"
    },
    "state": {
      "description": "Lifecycle state (#353/#358): `active` (physical stores exist) | `archiving` (an archive version is being written; reads/writes proceed) | `dormant` (only the Workspace archive exists; the next authenticated read/ingest triggers a restore and answers 503 + Retry-After) | `restoring` (a restore is in flight; 503 + Retry-After) | `lost` (the archive is missing or failed verification; 409 until an explicit restore succeeds). Null/absent for a collection the registry does not track (the settings-derived default).",
      "type": ["string", "null"],
      "enum": ["active", "archiving", "dormant", "restoring", "lost", null]
    },
    "archive_pending": {
      "description": "True when the last ingest/delete loaded but its archive step or upload failed: the collection stays active, cannot be evicted, and the owner's next authenticated call re-triggers the archive. Null/absent when untracked.",
      "type": ["boolean", "null"]
    },
    "versions": {
      "description": "Ordered archive version numbers recorded on the registry row (`versions/<n>/` in the owner's Workspace); a restore replays them in this order. Null/absent when untracked.",
      "type": ["array", "null"],
      "items": { "type": "integer" }
    },
    "count": {
      "description": "Tenant-scoped vector-store chunk count (own + public); null when unavailable.",
      "type": ["integer", "null"]
    },
    "text_count": {
      "description": "Tenant-scoped text-index (BM25) chunk count; compare against `count` for a vector<->text parity check. Null when unavailable.",
      "type": ["integer", "null"]
    },
    "provenance": {
      "description": "Build lineage from the collection's manifest; null when no manifest exists (e.g. COLLECTION_MANIFEST_DIR unset). `source` distinguishes a verified ingest record from lineage declared by the registry. Deliberately omits embedding_endpoints — internal infra URLs are not exposed on this principal-readable endpoint.",
      "type": ["object", "null"],
      "properties": {
        "collection": { "type": "string" },
        "model": { "type": "string" },
        "dim": { "type": ["integer", "null"] },
        "embedding_api": { "type": "string" },
        "chunk_method": { "type": ["string", "null"] },
        "chunk_size": { "type": ["integer", "null"] },
        "chunk_overlap": { "type": ["integer", "null"] },
        "chunk_params": { "type": "object" },
        "spec_hash": { "type": "string" },
        "corpus": { "type": "string" },
        "chunk_count": { "type": ["integer", "null"] },
        "ingested_at": { "type": "string" },
        "ragstack_version": { "type": "string" },
        "source": {
          "description": "\"ingest\" (verified: written by a real ingest run) | \"config\" (declared: materialized from the registry spec).",
          "type": "string"
        }
      },
      "additionalProperties": false
    }
  },
  "additionalProperties": false
}
