{"id":"salmonella-amr-pooled","label":"Salmonella AMR corpus — semantic_pooled (buffer 3, p80, min 500)","model":"Salesforce/SFR-Embedding-Mistral","dim":4096,"chunk_method":"semantic_pooled","chunk_size":null,"default":false,"is_default":false,"state":"active","archive_pending":false,"versions":[],"count":0,"text_count":null,"provenance":{"collection":"ragstack_lib_salmonella_amr_pooled_salesforce_sfr_embedding_4096_semantic_pooled_300cec5e","model":"Salesforce/SFR-Embedding-Mistral","dim":4096,"embedding_api":"openai","chunk_method":"semantic_pooled","chunk_size":null,"chunk_overlap":null,"chunk_params":{},"spec_hash":"10d1fcba","corpus":"","chunk_count":null,"ingested_at":"","ragstack_version":"0.1.0","source":"config"}}