{"id":"salmonella-amr-semantic","label":"Salmonella AMR corpus — semantic (buffer 3, p80, min 500)","model":"Salesforce/SFR-Embedding-Mistral","dim":4096,"chunk_method":"semantic","chunk_size":null,"default":false,"is_default":false,"state":"active","archive_pending":false,"versions":[],"count":0,"text_count":null,"provenance":{"collection":"ragstack_lib_salmonella_amr_semantic_salesforce_sfr_embedding_4096_semantic_9bcfa50f","model":"Salesforce/SFR-Embedding-Mistral","dim":4096,"embedding_api":"openai","chunk_method":"semantic","chunk_size":null,"chunk_overlap":null,"chunk_params":{},"spec_hash":"b2edb53e","corpus":"","chunk_count":null,"ingested_at":"","ragstack_version":"0.1.0","source":"config"}}